{
  "$schema": "http://json-schema.org/draft-07/schema#",
  "$id": "https://github.com/Wallet-Wall/walletwall-vault/blob/main/deployments/reproducibility/schema/reproducibility.schema.json",
  "title": "Deployment Reproducibility Manifest v1",
  "description": "Records whether a public testnet deployment can be reproduced from public repository sources, and — when it cannot — the committed remediation path. A manifest may only declare reproducibilityStatus 'reproducible' when its own facts support it (reported commit in public history, matching runtime bytes, and an artifactManifest with a source tag + bytecode hash). When artifactManifest.metadataHashMatch is explicitly false (the solc build-metadata CBOR hash was excluded from the equality claim), executableBytecodeMatch, metadataTrailerBytesExcluded, and a disclosure naming the exclusion are all required — this makes a 'code matches, non-executable metadata hash does not' claim impossible to state without also disclosing its exact scope. Testnet only; this file never documents a mainnet deployment. Validated by `npm run validate:reproducibility`.",
  "type": "object",
  "additionalProperties": false,
  "required": [
    "version",
    "subject",
    "environment",
    "chainId",
    "deployedAddress",
    "reportedSourceCommitInPublicHistory",
    "reproducibilityStatus",
    "lastChecked",
    "disclosures"
  ],
  "properties": {
    "$schema": { "type": "string" },
    "version": { "type": "string", "enum": ["1"] },
    "subject": {
      "type": "string",
      "description": "The deployed contract name this manifest is about (e.g. 'WalletWallVault')."
    },
    "environment": { "type": "string", "enum": ["local", "sepolia", "base-sepolia"] },
    "chainId": {
      "type": "integer",
      "description": "EVM chain ID. Testnets/local only; mainnet chain IDs are rejected by the validator.",
      "examples": [11155111, 84532, 31337]
    },
    "deployedAddress": { "type": "string", "pattern": "^0x[0-9a-fA-F]{40}$" },
    "deploymentTx": {
      "type": ["string", "null"],
      "pattern": "^0x[0-9a-fA-F]{64}$"
    },
    "reportedSourceCommit": {
      "type": ["string", "null"],
      "pattern": "^[0-9a-f]{40}$",
      "description": "The commit the deployment was reported to be built from."
    },
    "reportedSourceCommitInPublicHistory": {
      "type": "boolean",
      "description": "True only if reportedSourceCommit is actually present in public repository history."
    },
    "observedRuntimeBytes": {
      "type": ["integer", "null"],
      "minimum": 0,
      "description": "Byte length of the live deployed runtime bytecode."
    },
    "publicHeadRuntimeBytes": {
      "type": ["integer", "null"],
      "minimum": 0,
      "description": "Byte length of the runtime bytecode recompiled from public HEAD."
    },
    "reproducibilityStatus": {
      "type": "string",
      "enum": ["reproducible", "pending-source-alignment", "remediation-gated", "deprecated"],
      "description": "'reproducible' is permitted only when the facts support it (see validator honesty cross-check)."
    },
    "lastChecked": { "type": "string", "pattern": "^\\d{4}-\\d{2}-\\d{2}$" },
    "artifactManifest": {
      "type": ["object", "null"],
      "description": "Required (non-null) only when reproducibilityStatus is 'reproducible'.",
      "additionalProperties": true,
      "properties": {
        "sourceTag": { "type": "string" },
        "bytecodeHash": {
          "type": "string",
          "pattern": "^0x[0-9a-fA-F]{64}$",
          "description": "keccak256 of the runtime bytecode this claim actually covers. Equal to the raw on-chain runtime hash when metadataHashMatch is true; equal to the metadata-trailer-normalized hash when metadataHashMatch is false (see metadataTrailerBytesExcluded)."
        },
        "executableBytecodeMatch": {
          "type": "boolean",
          "description": "True only if every EXECUTED runtime byte (i.e. excluding the trailing solc metadata region, and — for contracts with `immutable` variables — excluding the per-deployment immutable slots, whose values are instead verified independently) is byte-for-byte identical between the live on-chain deployment and a clean local recompile."
        },
        "metadataHashMatch": {
          "type": "boolean",
          "description": "True only if the trailing solc CBOR build-metadata hash (a non-executed IPFS content pointer, not run by the EVM) also matches byte-for-byte between the live deployment and a clean local recompile. This is commonly false even for genuinely reproducible source, since the metadata hash is sensitive to the exact build environment (OS/toolchain/path) that produced it — see metadataTrailerBytesExcluded."
        },
        "metadataTrailerBytesExcluded": {
          "type": "integer",
          "minimum": 0,
          "maximum": 128,
          "description": "Required, and bounded to a small value, whenever metadataHashMatch is false: the exact number of trailing bytes excluded from the reproducibility claim (the solc CBOR metadata region only). Bounding this tightly prevents the exclusion from silently growing to cover real executable logic in a future edit."
        },
        "immutableValuesIndependentlyVerified": {
          "type": "boolean",
          "description": "For contracts with `immutable` variables only: true if every immutable slot's on-chain value was independently re-derived from public inputs (constructor arguments, the contract's own deployed address, chain ID, and any relevant construction-time constants) and matched, rather than merely observed."
        },
        "constructorArgs": {
          "type": "array",
          "items": { "type": "string" },
          "description": "The exact constructor arguments used at deployment, in order, as recorded in the deployment metadata — supports independently re-deriving any immutable variable values."
        }
      }
    },
    "remediation": {
      "type": "object",
      "description": "Required when reproducibilityStatus is not 'reproducible'. Documents the concrete path to reproducibility.",
      "additionalProperties": true,
      "required": ["chosenPath", "steps", "recordToUpdate"],
      "properties": {
        "chosenPath": {
          "type": "string",
          "enum": ["redeploy-from-public-head", "publish-source-tag-and-manifest"]
        },
        "rationale": { "type": "string" },
        "steps": {
          "type": "array",
          "minItems": 1,
          "items": { "type": "string", "minLength": 10 }
        },
        "recordToUpdate": { "type": "string" },
        "alternatePath": { "type": "string" }
      }
    },
    "disclosures": {
      "type": "array",
      "minItems": 1,
      "items": { "type": "string", "minLength": 10 }
    }
  }
}
